<?xml version="1.0" encoding="UTF-8"?>
<circuito xmlns="http://www.uniovi.es" xmlns:xsi="http://www.w3.org/2001/XMLSchema-instance" xsi:schemaLocation="http://www.uniovi.es circuito.xsd" nombre="Le Mans" vueltas="27" localidad_proxima="Le Mans" pais="Francia">
    <longitud_circuito unidad="metros">4187</longitud_circuito>
    <anchura_media unidad="metros">13</anchura_media>
    <fecha_2025>2025-05-11</fecha_2025>
    <hora_carrera_españa>14:00:00</hora_carrera_españa>
    <patrocinador>Michelin</patrocinador>
        <referencias>
            <referencia>https://www.motogp.com/es/calendar/2025/event/france/e9b386c5-9d95-405e-880e-7d9105ce1cbe?tab=overview</referencia>
            <referencia>https://es.wikipedia.org/wiki/Gran_Premio_de_Francia_de_Motociclismo</referencia>
            <referencia>https://www.dazn.com/es-ES/news/motor/circuito-le-mans-donde-esta-como-es-caracteristicas-como-llegar-fotos-escenario-gp-francia-mundial-motogp/1ds4qyf2z4y5wz5uatyt4s8lh</referencia>
            <referencia>https://es.motorsport.com/motogp/news/mundiales-motogp-2025-puntos-posiciones-francia/10721575/</referencia>
        </referencias>
        <fotos>
            <foto>multimedia/lemans_aereo.jpg</foto>
            <foto>multimedia/lemans_meta.jpg</foto>
            <foto>multimedia/lemans_tramos.jpg</foto>
        </fotos>
        <videos>
            <video>multimedia/lemans.mp4</video>
            <video>multimedia/zarco.mp4</video>
        </videos>
        <coordenadas_inicio>
            <coordenada>
                <longitud>0.2075998</longitud>
                <latitud>47.9511720</latitud>
                <altitud unidad="metros">53.68</altitud>
            </coordenada>
        </coordenadas_inicio>
        <tramos>
            <tramo sector="1">
                <distancia unidad="metros">175.47</distancia>
                <coordenada>
                    <longitud>0.2076845</longitud>
                    <latitud>47.9527561</latitud>
                    <altitud unidad="metros">56.06</altitud>
                </coordenada>
            </tramo>
            <tramo sector="1">
                <distancia unidad="metros">65.57</distancia>
                <coordenada>
                    <longitud>0.2077719</longitud>
                    <latitud>47.9533405</latitud>
                    <altitud unidad="metros">57.30</altitud>
                </coordenada>
            </tramo>
            <tramo sector="1">
                <distancia unidad="metros">115.61</distancia>
                <coordenada>
                    <longitud>0.2081108</longitud>
                    <latitud>47.9543599</latitud>
                    <altitud unidad="metros">60.72</altitud>
                </coordenada>
            </tramo>
            <tramo sector="1">
                <distancia unidad="metros">67.97</distancia>
                <coordenada>
                    <longitud>0.2084193</longitud>
                    <latitud>47.9549459</latitud>
                    <altitud unidad="metros">63.52</altitud>
                </coordenada>
            </tramo>
            <tramo sector="1">
                <distancia unidad="metros">52.08</distancia>
                <coordenada>
                    <longitud>0.2087131</longitud>
                    <latitud>47.9553673</latitud>
                    <altitud unidad="metros">65.77</altitud>
                </coordenada>
            </tramo>
            <tramo sector="1">
                <distancia unidad="metros">50.94</distancia>
                <coordenada>
                    <longitud>0.2091662</longitud>
                    <latitud>47.9557153</latitud>
                    <altitud unidad="metros">67.95</altitud>
                </coordenada>
            </tramo>
            <tramo sector="1">
                <distancia unidad="metros">156.17</distancia>
                <coordenada>
                    <longitud>0.2109462</longitud>
                    <latitud>47.9564535</latitud>
                    <altitud unidad="metros">74.30</altitud>
                </coordenada>
            </tramo>
            <tramo sector="1">
                <distancia unidad="metros">21.83</distancia>
                <coordenada>
                    <longitud>0.2110410</longitud>
                    <latitud>47.9566379</latitud>
                    <altitud unidad="metros">75.52</altitud>
                </coordenada>
            </tramo>
            <tramo sector="1">
                <distancia unidad="metros">46</distancia>
                <coordenada>
                    <longitud>0.2109203</longitud>
                    <latitud>47.9570365</latitud>
                    <altitud unidad="metros">78.24</altitud>
                </coordenada>
            </tramo>
            <tramo sector="1">
                <distancia unidad="metros">22.87</distancia>
                <coordenada>
                    <longitud>0.2110802</longitud>
                    <latitud>47.9572076</latitud>
                    <altitud unidad="metros">79.12</altitud>
                </coordenada>
            </tramo>
            <tramo sector="1">
                <distancia unidad="metros">165.75</distancia>
                <coordenada>
                    <longitud>0.2129530</longitud>
                    <latitud>47.9580023</latitud>
                    <altitud unidad="metros">80.85</altitud>
                </coordenada>
            </tramo>
            <tramo sector="1">
                <distancia unidad="metros">38.85</distancia>
                <coordenada>
                    <longitud>0.2133147</longitud>
                    <latitud>47.9582415</latitud>
                    <altitud unidad="metros">79.89</altitud>
                </coordenada>
            </tramo>
            <tramo sector="2">
                <distancia unidad="metros">70.80</distancia>
                <coordenada>
                    <longitud>0.2138827</longitud>
                    <latitud>47.9587447</latitud>
                    <altitud unidad="metros">76.87</altitud>
                </coordenada>
            </tramo>
            <tramo sector="2">
                <distancia unidad="metros">55.84</distancia>
                <coordenada>
                    <longitud>0.2144339</longitud>
                    <latitud>47.9590757</latitud>
                    <altitud unidad="metros">73.21</altitud>
                </coordenada>
            </tramo>
            <tramo sector="2">
                <distancia unidad="metros">37.64</distancia>
                <coordenada>
                    <longitud>0.2149427</longitud>
                    <latitud>47.9591195</latitud>
                    <altitud unidad="metros">70.58</altitud>
                </coordenada>
            </tramo>
            <tramo sector="2">
                <distancia unidad="metros">46.49</distancia>
                <coordenada>
                    <longitud>0.2155021</longitud>
                    <latitud>47.9589275</latitud>
                    <altitud unidad="metros">68.33</altitud>
                </coordenada>
            </tramo>
            <tramo sector="2">
                <distancia unidad="metros">43.94</distancia>
                <coordenada>
                    <longitud>0.2156786</longitud>
                    <latitud>47.9585480</latitud>
                    <altitud unidad="metros">67.67</altitud>
                </coordenada>
            </tramo>
            <tramo sector="2">
                <distancia unidad="metros">42.20</distancia>
                <coordenada>
                    <longitud>0.2154957</longitud>
                    <latitud>47.9581805</latitud>
                    <altitud unidad="metros">68.70</altitud>
                </coordenada>
            </tramo>
            <tramo sector="2">
                <distancia unidad="metros">89.08</distancia>
                <coordenada>
                    <longitud>0.2147220</longitud>
                    <latitud>47.9575653</latitud>
                    <altitud unidad="metros">71.58</altitud>
                </coordenada>
            </tramo>
            <tramo sector="2">
                <distancia unidad="metros">179.50</distancia>
                <coordenada>
                    <longitud>0.2128730</longitud>
                    <latitud>47.9565480</latitud>
                    <altitud unidad="metros">72.14</altitud>
                </coordenada>
            </tramo>
            <tramo sector="2">
                <distancia unidad="metros">49.45</distancia>
                <coordenada>
                    <longitud>0.2124487</longitud>
                    <latitud>47.9562141</latitud>
                    <altitud unidad="metros">71.23</altitud>
                </coordenada>
            </tramo>
            <tramo sector="2">
                <distancia unidad="metros">31.62</distancia>
                <coordenada>
                    <longitud>0.2124465</longitud>
                    <latitud>47.9559397</latitud>
                    <altitud unidad="metros">70.37</altitud>
                </coordenada>
            </tramo>
            <tramo sector="2">
                <distancia unidad="metros">36.04</distancia>
                <coordenada>
                    <longitud>0.2127516</longitud>
                    <latitud>47.9556941</latitud>
                    <altitud unidad="metros">69.41</altitud>
                </coordenada>
            </tramo>
            <tramo sector="2">
                <distancia unidad="metros">57.60</distancia>
                <coordenada>
                    <longitud>0.2135153</longitud>
                    <latitud>47.9557001</latitud>
                    <altitud unidad="metros">68.03</altitud>
                </coordenada>
            </tramo>
            <tramo sector="2">
                <distancia unidad="metros">57.70</distancia>
                <coordenada>
                    <longitud>0.2142224</longitud>
                    <latitud>47.9559049</latitud>